{
  "schema_version": 1,
  "package_id": "pkg-test-0001",
  "run_id": "ai-news-morning-2026-08-28",
  "workflow": "hyperframes",
  "stream": "ai-news",
  "edition": "morning",
  "cadence": "daily",
  "created_at": "2026-08-28T00:30:00Z",
  "expires_at": "2026-08-29T00:30:00Z",
  "producer_commit": "0000000000000000000000000000000000000000",
  "package_state": "READY_FOR_PUBLISH",
  "assets": [
    {
      "path": "renders/short.mp4",
      "type": "video",
      "size_bytes": 1048576,
      "mime": "video/mp4",
      "width": 1080,
      "height": 1920,
      "duration_ms": 30000,
      "sha256": "e3b0c44298fc1c149afbf4c8996fb92427ae41e4649b934ca495991b7852b855"
    },
    {
      "path": "renders/long.mp4",
      "type": "video",
      "size_bytes": 2097152,
      "mime": "video/mp4",
      "width": 1920,
      "height": 1080,
      "duration_ms": 60000,
      "sha256": "e3b0c44298fc1c149afbf4c8996fb92427ae41e4649b934ca495991b7852b855"
    }
  ],
  "targets": [
    {
      "platform": "bilibili",
      "account_ref": "test-account",
      "title": "测试日报",
      "description": "脱敏测试包",
      "tags": [
        "测试"
      ],
      "statement": "测试声明",
      "subtitle_path": "timeline/subtitle.srt",
      "cover_path": "covers/cover.png",
      "publish_policy": "draft_only"
    }
  ],
  "timeline": {
    "path": "timeline/timeline.json",
    "sha256": "e3b0c44298fc1c149afbf4c8996fb92427ae41e4649b934ca495991b7852b855",
    "block_count": 8
  },
  "content_refs": {
    "source_snapshots": [
      {
        "url": "https://example.com/article/1",
        "sha256": "e3b0c44298fc1c149afbf4c8996fb92427ae41e4649b934ca495991b7852b855",
        "language": "zh"
      }
    ]
  },
  "review": {
    "status": "completed",
    "verdict": "pass",
    "reports": [
      {
        "video": "renders/short.mp4",
        "provider": "test-provider",
        "model": "test-model",
        "reviewed_at": "2026-08-28T00:20:00Z",
        "timeline_hash": "e3b0c44298fc1c149afbf4c8996fb92427ae41e4649b934ca495991b7852b855",
        "config_hash": "e3b0c44298fc1c149afbf4c8996fb92427ae41e4649b934ca495991b7852b855"
      }
    ]
  },
  "signature": {
    "algorithm": "Ed25519",
    "key_id": "test-key-1",
    "canonicalization": "JCS",
    "value": "3aKGLHBQt3INj0p--O2FGLlu4MwGkGU2fTs5O3IXj3dvSbGqfmkbkLsr39B79A97iwEacUcr7cRv5uFFeZdWAQ"
  }
}
